{
  "$schema": "./_schema.json#",
  "license": [
    "Copyright Matthias Koch 2017.",
    "Distributed under the MIT License.",
    "https://github.com/nuke-build/tools/blob/master/LICENSE"
  ],
  "references": [
    "https://raw.githubusercontent.com/GitTools/GitLink/1520bf13cf35337a368aa0c960135c564e519fbf/src/GitLink/Program.cs"
  ],
  "name": "GitLink3",
  "officialUrl": "https://github.com/GitTools/GitLink/",
  "help": "GitLink makes symbol servers obsolete which saves you both time with uploading source files with symbols and the user no longer has to specify custom symbol servers (such as symbolsource.org). The advantage of GitLink is that it is fully customized for Git. It also works with GitHub or BitBucket urls so it does not require a local git repository to work. This makes it perfectly usable in continuous integration servers such as Continua CI. Updating all the pdb files is very fast. A solution with over 85 projects will be handled in less than 30 seconds. When using GitLink, the user no longer has to specify symbol servers. The only requirement is to ensure the check the Enable source server support option in Visual Studio.",
  "packageId": "gitlink",
  "packageExecutable": "GitLink.exe",
  "tasks": [
    {
      "settingsClass": {
        "properties": [
          {
            "name": "PdbFile",
            "type": "string",
            "format": "{value}",
            "help": "The PDB to add source indexing to."
          },
          {
            "name": "Method",
            "type": "GitLinkSourceCodeRetrieval",
            "format": "--method {value}",
            "help": "The method for SRCSRV to retrieve source code. One of &lt;Http|Powershell&gt;. Default is Http."
          },
          {
            "name": "RepositoryUrl",
            "type": "string",
            "format": "--url {value}",
            "help": "Url to remote git repository."
          },
          {
            "name": "CommitSha",
            "type": "string",
            "format": "--commit {value}",
            "help": "The git ref to assume all the source code belongs to."
          },
          {
            "name": "BaseDirectory",
            "type": "string",
            "format": "--baseDir {value}",
            "help": "The path to the root of the git repo."
          },
          {
            "name": "SkipVerification",
            "type": "bool",
            "format": "--skipVerify",
            "help": "Skip verification that all source files are available in source control."
          }
        ]
      }
    }
  ],
  "enumerations": [
    {
      "name": "GitLinkSourceCodeRetrieval",
      "values": [
        "Http",
        "Powershell"
      ]
    }
  ]
}